[
  {
    "id": "nike-product-1",
    "title": "Nike Air Zoom Pegasus 40",
    "slug": "nike-air-zoom-pegasus-40",
    "content_type": "product",
    "description": "Responsive cushioning for everyday runs.",
    "full_text_content": "Discover the Nike Air Zoom Pegasus 40 with its responsive cushioning for everyday runs. Perfect for athletes. Shop now and experience Nike innovation.",
    "image_url": "https://images.unsplash.com/photo-1542291026-7eec264c27ff?w=400&h=300&fit=crop",
    "url": "https://www.nike.com/product/nike-air-zoom-pegasus-40",
    "tags": ["running", "shoes", "performance", "nike", "sportswear"],
    "categories": ["footwear", "men", "women", "nike"],
    "related_entities": ["Nike", "Just Do It"],
    "brand_or_person": "Nike",
    "date_published": "2025-08-22",
    "author": "Nike Marketing",
    "sentiment": "positive",
    "ai_summary": "A detailed overview of the Nike Air Zoom Pegasus 40, highlighting its features and benefits for comfort."
  },
  {
    "id": "nike-product-2",
    "title": "Nike Dri-FIT ADV Techknit Ultra",
    "slug": "nike-dri-fit-adv-techknit-ultra",
    "content_type": "product",
    "description": "Lightweight, breathable running top.",
    "full_text_content": "Discover the Nike Dri-FIT ADV Techknit Ultra with its lightweight, breathable running top. Perfect for training. Shop now and experience Nike innovation.",
    "image_url": "https://images.unsplash.com/photo-1556821840-3a63f95609a7?w=400&h=300&fit=crop",
    "url": "https://www.nike.com/product/nike-dri-fit-adv-techknit-ultra",
    "tags": ["apparel", "running", "dri-fit", "nike", "sportswear"],
    "categories": ["apparel", "men", "nike"],
    "related_entities": ["Nike", "Just Do It"],
    "brand_or_person": "Nike",
    "date_published": "2025-09-03",
    "author": "Nike Marketing",
    "sentiment": "neutral",
    "ai_summary": "A detailed overview of the Nike Dri-FIT ADV Techknit Ultra, highlighting its features and benefits for comfort."
  },
  {
    "id": "nike-product-3",
    "title": "Nike Sportswear Tech Fleece Hoodie",
    "slug": "nike-sportswear-tech-fleece-hoodie",
    "content_type": "product",
    "description": "Premium warmth without the weight.",
    "full_text_content": "Discover the Nike Sportswear Tech Fleece Hoodie with its premium warmth without the weight. Perfect for training. Shop now and experience Nike innovation.",
    "image_url": "https://images.unsplash.com/photo-1556821840-3a63f95609a7?w=400&h=300&fit=crop",
    "url": "https://www.nike.com/product/nike-sportswear-tech-fleece-hoodie",
    "tags": ["hoodie", "fleece", "casual", "nike", "sportswear"],
    "categories": ["apparel", "men", "women", "nike"],
    "related_entities": ["Nike", "Just Do It"],
    "brand_or_person": "Nike",
    "date_published": "2025-08-30",
    "author": "Nike Marketing",
    "sentiment": "positive",
    "ai_summary": "A detailed overview of the Nike Sportswear Tech Fleece Hoodie, highlighting its features and benefits for performance."
  },
  {
    "id": "nike-product-4",
    "title": "Nike Air Force 1 '07",
    "slug": "nike-air-force-1-07",
    "content_type": "product",
    "description": "Classic style, modern comfort.",
    "full_text_content": "Discover the Nike Air Force 1 '07 with its classic style, modern comfort. Perfect for daily wear. Shop now and experience Nike innovation.",
    "image_url": "https://images.unsplash.com/photo-1549298916-b41d501d3772?w=400&h=300&fit=crop",
    "url": "https://www.nike.com/product/nike-air-force-1-07",
    "tags": ["sneakers", "lifestyle", "classic", "nike", "sportswear"],
    "categories": ["footwear", "men", "women", "nike"],
    "related_entities": ["Nike", "Just Do It"],
    "brand_or_person": "Nike",
    "date_published": "2025-08-18",
    "author": "Nike Marketing",
    "sentiment": "positive",
    "ai_summary": "A detailed overview of the Nike Air Force 1 '07, highlighting its features and benefits for style."
  },
  {
    "id": "nike-product-5",
    "title": "Nike Yoga Dri-FIT Pants",
    "slug": "nike-yoga-dri-fit-pants",
    "content_type": "product",
    "description": "Soft, flexible fabric for your practice.",
    "full_text_content": "Discover the Nike Yoga Dri-FIT Pants with its soft, flexible fabric for your practice. Perfect for athletes. Shop now and experience Nike innovation.",
    "image_url": "https://images.unsplash.com/photo-1506629082955-511b1aa562c8?w=400&h=300&fit=crop",
    "url": "https://www.nike.com/product/nike-yoga-dri-fit-pants",
    "tags": ["yoga", "pants", "comfort", "nike", "sportswear"],
    "categories": ["apparel", "women", "nike"],
    "related_entities": ["Nike", "Just Do It"],
    "brand_or_person": "Nike",
    "date_published": "2025-08-30",
    "author": "Nike Marketing",
    "sentiment": "neutral",
    "ai_summary": "A detailed overview of the Nike Yoga Dri-FIT Pants, highlighting its features and benefits for style."
  },
  {
    "id": "nike-campaign-1",
    "title": "Just Do It: The Power of Sport",
    "slug": "just-do-it-the-power-of-sport",
    "content_type": "campaign",
    "description": "Inspiring athletes worldwide.",
    "full_text_content": "The iconic 'Just Do It' campaign continues to motivate generations. This article explores its enduring legacy and impact on sports culture, featuring stories of perseverance and triumph. Nike believes in the power of sport to unite and inspire, pushing boundaries and achieving greatness. From grassroots initiatives to global events, Nike champions athletes at every level, fostering a community dedicated to pushing limits. The campaign highlights how sport can transform lives, building character and resilience. It's more than just a slogan; it's a philosophy that encourages everyone to embrace challenges and strive for their personal best. Nike's commitment to innovation in athletic wear supports this vision, providing tools for athletes to perform at their peak. Join the movement and discover your own potential, because in the world of sport, anything is possible if you just do it.",
    "image_url": "https://images.unsplash.com/photo-1461896836934-ffe607ba8211?w=400&h=300&fit=crop",
    "url": "https://about.nike.com/newsroom/campaigns/just-do-it-the-power-of-sport",
    "tags": ["campaign", "inspiration", "sport", "nike", "marketing"],
    "categories": ["marketing", "news"],
    "related_entities": ["Nike", "Athletes", "Inspiration"],
    "brand_or_person": "Nike",
    "date_published": "2025-07-24",
    "author": "Nike Newsroom",
    "sentiment": "positive",
    "ai_summary": "An in-depth look at Nike's 'Just Do It: The Power of Sport' campaign, exploring its message and impact on global sports culture."
  },
  {
    "id": "nike-campaign-2",
    "title": "Why Do It? Connecting with the Next Generation",
    "slug": "why-do-it-connecting-with-the-next-generation",
    "content_type": "campaign",
    "description": "Nike's latest campaign for young athletes.",
    "full_text_content": "'Why Do It?' is Nike's fresh take on inspiring young athletes. This campaign delves into the personal motivations behind pursuing sport, encouraging self-discovery and passion. It features emerging talents sharing their journeys, challenges, and the joy they find in their respective disciplines. Nike aims to foster a deeper connection with the youth, understanding their unique perspectives and aspirations. The narrative emphasizes that the 'why' behind participation is as crucial as the 'what,' promoting a holistic approach to athletic development. Through compelling storytelling and vibrant visuals, the campaign showcases the diverse reasons individuals engage in sport, from personal growth to community building. It's a celebration of individuality and the collective spirit of athleticism, inviting the next generation to define their own path with Nike.",
    "image_url": "https://images.unsplash.com/photo-1552674605-db6ffd4facb5?w=400&h=300&fit=crop",
    "url": "https://about.nike.com/newsroom/campaigns/why-do-it-connecting-with-the-next-generation",
    "tags": ["campaign", "youth", "motivation", "nike", "marketing"],
    "categories": ["marketing", "news"],
    "related_entities": ["Nike", "Athletes", "Inspiration"],
    "brand_or_person": "Nike",
    "date_published": "2025-08-09",
    "author": "Nike Newsroom",
    "sentiment": "positive",
    "ai_summary": "An in-depth look at Nike's 'Why Do It? Connecting with the Next Generation' campaign, exploring its message and impact on global sports culture."
  },
  {
    "id": "nike-campaign-3",
    "title": "Winning Isn't for Everyone: Celebrating Effort",
    "slug": "winning-isnt-for-everyone-celebrating-effort",
    "content_type": "campaign",
    "description": "Focusing on the journey, not just the outcome.",
    "full_text_content": "'Winning Isn't for Everyone' is a powerful campaign that shifts focus from victory to the invaluable effort and dedication involved in sports. It celebrates the grind, the setbacks, and the relentless pursuit of improvement, recognizing that true success lies in the journey itself. Featuring a diverse roster of athletes, the campaign highlights their struggles and triumphs, emphasizing that every step forward, regardless of the final score, is a win. Nike promotes a culture where resilience and passion are paramount, encouraging athletes to embrace challenges and learn from every experience. This narrative resonates deeply, reminding us that the spirit of sport is found in the commitment to personal excellence and the courage to keep going, even when the odds are stacked against you. It's a testament to the idea that effort, not just outcome, defines an athlete's legacy.",
    "image_url": "https://images.unsplash.com/photo-1517649763962-0c623066013b?w=400&h=300&fit=crop",
    "url": "https://about.nike.com/newsroom/campaigns/winning-isnt-for-everyone-celebrating-effort",
    "tags": ["campaign", "effort", "journey", "nike", "marketing"],
    "categories": ["marketing", "news"],